{
  "$schema": "https://json-schema.org/draft/2020-12/schema",
  "type": "object",
  "additionalProperties": false,
  "required": [
    "world",
    "vehicle",
    "mission",
    "scenario",
    "output_root",
    "max_wall_seconds",
    "startup_wall_seconds",
    "finalization_wall_seconds",
    "recording"
  ],
  "properties": {
    "world": {"type": "string", "minLength": 1},
    "vehicle": {"type": "string", "minLength": 1},
    "mission": {"type": "string", "minLength": 1},
    "scenario": {"type": "string", "minLength": 1},
    "output_root": {"type": "string", "minLength": 1},
    "max_wall_seconds": {"type": "integer", "minimum": 1},
    "startup_wall_seconds": {"type": "integer", "minimum": 1},
    "finalization_wall_seconds": {"type": "integer", "minimum": 1},
    "launch_mode": {"enum": ["unattended", "operator"], "default": "unattended"},
    "preparation_wall_seconds": {"type": "integer", "minimum": 1, "default": 1800},
    "recording": {"$ref": "#/$defs/recording"},
    "runtime_profile": {"enum": ["phase2", "phase3"]},
    "simulation": {"$ref": "#/$defs/simulation"},
    "competition": {"$ref": "#/$defs/competition"},
    "mission_plan": {"$ref": "#/$defs/mission_plan"},
    "calibration": {"$ref": "#/$defs/calibration_source"},
    "calibration_profile": {"type": "object"},
    "calibration_validation": {"type": "boolean", "default": false}
  },
  "allOf": [
    {
      "if": {
        "required": ["runtime_profile"],
        "properties": {"runtime_profile": {"const": "phase3"}}
      },
      "then": {"required": ["simulation"]},
      "else": {"not": {"required": ["simulation"]}}
    },
    {
      "if": {
        "anyOf": [
          {"properties": {"mission": {"const": "comp2026_auto"}}},
          {"properties": {"scenario": {"const": "moving_pad_v1"}}}
        ]
      },
      "then": {"properties": {"recording": {"$ref": "#/$defs/competition_recording"}}},
      "else": {"properties": {"recording": {"$ref": "#/$defs/baseline_recording"}}}
    },
    {
      "if": {"properties": {"mission": {"const": "comp2026_auto"}}},
      "then": {"required": ["competition"]}
    },
    {
      "if": {"properties": {"mission": {"const": "configured"}}},
      "then": {
        "required": ["runtime_profile", "mission_plan"],
        "properties": {"runtime_profile": {"const": "phase3"}}
      },
      "else": {"not": {"required": ["mission_plan"]}}
    },
    {
      "if": {"required": ["calibration"]},
      "then": {"properties": {"mission": {"enum": ["configured", "controlled_descent", "hover_roll", "autotune_roll", "comp2026_auto"]}}}
    },
    {
      "if": {"required": ["calibration_validation"], "properties": {"calibration_validation": {"const": true}}},
      "then": {"required": ["calibration"], "properties": {"mission": {"const": "configured"}}}
    },
    {
      "if": {"properties": {"mission": {"const": "autotune"}}},
      "else": {"not": {"required": ["calibration_profile"]}}
    },
    {
      "if": {"anyOf": [
        {"properties": {"world": {"enum": ["moving_pad_landing", "moving_pad_stationary"]}}},
        {"properties": {"vehicle": {"const": "iris_moving_pad"}}},
        {"properties": {"scenario": {"const": "moving_pad_v1"}}}
      ]},
      "then": {
        "required": ["runtime_profile", "simulation"],
        "not": {"required": ["competition"]},
        "properties": {
          "world": {"enum": ["moving_pad_landing", "moving_pad_stationary"]},
          "vehicle": {"const": "iris_moving_pad"},
          "mission": {"const": "configured"},
          "scenario": {"const": "moving_pad_v1"},
          "runtime_profile": {"const": "phase3"},
          "simulation": {"properties": {"public_epoch_native_sim_seconds": {"const": 90}}}
        }
      }
    }
  ],
  "$defs": {
    "calibration_source": {
      "type": "object",
      "additionalProperties": false,
      "required": ["source_run_directory"],
      "properties": {"source_run_directory": {"type": "string", "minLength": 1}}
    },
    "recording": {
      "type": "object",
      "additionalProperties": false,
      "required": ["width_px", "height_px", "fps", "encoding"],
      "properties": {
        "width_px": {"enum": [320, 640]},
        "height_px": {"enum": [240, 480]},
        "fps": {"const": 20},
        "encoding": {"const": "rgb8"}
      },
      "oneOf": [
        {"properties": {"width_px": {"const": 320}, "height_px": {"const": 240}}},
        {"properties": {"width_px": {"const": 640}, "height_px": {"const": 480}}}
      ]
    },
    "competition_recording": {
      "type": "object",
      "properties": {
        "width_px": {"const": 640},
        "height_px": {"const": 480}
      }
    },
    "baseline_recording": {
      "type": "object",
      "properties": {
        "width_px": {"const": 320},
        "height_px": {"const": 240}
      }
    },
    "competition": {
      "type": "object",
      "additionalProperties": false,
      "required": ["course", "scenario"],
      "properties": {
        "course": {"type": "string", "pattern": "^(?!/)(?!.*(?:^|/)\\.\\.(?:/|$)).+$"},
        "scenario": {"type": "string", "pattern": "^(?!/)(?!.*(?:^|/)\\.\\.(?:/|$)).+$"}
      }
    },
    "mission_plan": {
      "type": "object",
      "additionalProperties": false,
      "required": ["schema_version", "steps"],
      "properties": {
        "schema_version": {"const": 1},
        "steps": {
          "type": "array",
          "minItems": 1,
          "items": {"$ref": "#/$defs/mission_step"}
        }
      }
    },
    "mission_step": {
      "type": "object",
      "additionalProperties": false,
      "required": ["tool", "args"],
      "properties": {
        "tool": {"type": "string", "minLength": 1},
        "args": {"type": "object"},
        "timeout_sim_s": {"type": "number", "exclusiveMinimum": 0, "default": 60}
      }
    },
    "simulation": {
      "type": "object",
      "additionalProperties": false,
      "required": ["seed", "duration_sim_seconds", "public_epoch_native_sim_seconds", "target_real_time_factor"],
      "properties": {
        "seed": {"type": "integer", "minimum": 0, "maximum": 4294967295},
        "duration_sim_seconds": {
          "type": "number",
          "exclusiveMinimum": 0
        },
        "public_epoch_native_sim_seconds": {
          "type": "number",
          "exclusiveMinimum": 0,
          "multipleOf": 0.05
        },
        "target_real_time_factor": {"enum": [0.1, 0.25, 1.0]}
      }
    }
  }
}
