{
  "world": "moving_pad_stationary",
  "vehicle": "iris_moving_pad",
  "mission": "configured",
  "mission_plan": {
    "schema_version": 1,
    "steps": [
      {"tool": "set_mode", "args": {"mode": "GUIDED"}, "timeout_sim_s": 10},
      {"tool": "arm", "args": {}, "timeout_sim_s": 10},
      {"tool": "takeoff", "args": {"altitude_m": 5.0}, "timeout_sim_s": 20},
      {
        "tool": "goto_waypoint",
        "args": {"latitude_deg": 37.4003371, "longitude_deg": -122.079639322083, "altitude_m": 5.0, "tolerance_m": 0.3},
        "timeout_sim_s": 25
      },
      {
        "tool": "precision_land",
        "args": {"marker_id": 7, "settle_by_sim_s": 45, "acquire_by_sim_s": 60},
        "timeout_sim_s": 90
      }
    ]
  },
  "scenario": "moving_pad_v1",
  "output_root": "runs",
  "max_wall_seconds": 3600,
  "startup_wall_seconds": 120,
  "finalization_wall_seconds": 120,
  "recording": {"width_px": 640, "height_px": 480, "fps": 20, "encoding": "rgb8"},
  "runtime_profile": "phase3",
  "simulation": {
    "seed": 1,
    "duration_sim_seconds": 90.0,
    "public_epoch_native_sim_seconds": 90.0,
    "target_real_time_factor": 0.1
  }
}
