{
  "world": "vertical_descent",
  "vehicle": "iris_flight",
  "mission": "autotune",
  "scenario": "calibration_v1",
  "output_root": "runs",
  "max_wall_seconds": 7200,
  "startup_wall_seconds": 900,
  "finalization_wall_seconds": 300,
  "recording": {
    "width_px": 320,
    "height_px": 240,
    "fps": 20,
    "encoding": "rgb8"
  },
  "runtime_profile": "phase3",
  "simulation": {
    "seed": 2026,
    "duration_sim_seconds": 600.0,
    "public_epoch_native_sim_seconds": 90.0,
    "target_real_time_factor": 0.25
  }
}
