{
  "world": "vertical_descent",
  "vehicle": "iris_flight",
  "mission": "configured",
  "mission_plan": {
    "schema_version": 1,
    "steps": [
      {"tool": "set_mode", "args": {"mode": "GUIDED"}},
      {"tool": "arm", "args": {}},
      {"tool": "takeoff", "args": {"altitude_m": 5.0}},
      {"tool": "hold", "args": {"duration_sim_s": 10.0}},
      {"tool": "land", "args": {}}
    ]
  },
  "scenario": "descent_v1",
  "calibration": {"source_run_directory": "../runs/SOURCE_RUN_ID"},
  "output_root": "runs",
  "max_wall_seconds": 7200,
  "startup_wall_seconds": 900,
  "finalization_wall_seconds": 300,
  "recording": {
    "width_px": 320,
    "height_px": 240,
    "fps": 20,
    "encoding": "rgb8"
  },
  "runtime_profile": "phase3",
  "simulation": {
    "seed": 1,
    "duration_sim_seconds": 120.0,
    "public_epoch_native_sim_seconds": 90.0,
    "target_real_time_factor": 0.25
  }
}
